type,message,urgency,timestamp,period,decision_context
monitoring,"The FDA is closely monitoring the current market situation involving emerging disruptions among manufacturers. While supply remains adequate, we encourage manufacturers to report any anticipated supply issues and for healthcare providers to ensure efficient use of current stocks. Coordination among industry stakeholders is crucial at this time to prevent escalation.",routine,2025-07-30T13:30:25.992604,0,"{'shortage_assessment': 'The shortage is emerging with some market disruption, but supply is still adequate. Coordination might be helpful, but there is no confirmed shortage yet.', 'intervention_justification': 'A monitoring statement is appropriate to heighten awareness and encourage voluntary reporting without causing panic buying or significant market disruption.', 'market_impact_prediction': 'Manufacturers may be more vigilant in reporting and potentially adjusting production plans. Buyers are less likely to stockpile given the assurance of current adequacy.', 'patient_safety_considerations': 'Patient safety risk is low for now, as supply is still adequate. Keeping stakeholders informed can help maintain access.'}"
monitoring,The FDA is aware of the emerging shortage and is monitoring the situation closely. Manufacturers are encouraged to report any production challenges to facilitate coordination.,routine,2025-07-30T13:31:15.585295,1,"{'shortage_assessment': 'The shortage is in its early stages with insufficient supply and some disruptions among manufacturers. However, patient safety risk is currently low.', 'intervention_justification': 'A monitoring statement is appropriate to raise awareness and encourage voluntary reporting, potentially promoting early coordination without causing unnecessary panic.', 'market_impact_prediction': 'Manufacturers may be incentivized to address disruptions proactively. Buyers are unlikely to engage in panic buying as we are not confirming a critical shortage.', 'patient_safety_considerations': 'The low patient safety risk allows for a measured response, focusing on improving coordination without creating unnecessary urgency.'}"
monitoring,The FDA is aware of emerging drug shortages and encourages manufacturers to report supply disruptions. We are closely monitoring the situation and will provide guidance to address coordination needs as necessary.,elevated,2025-07-30T13:31:59.825892,2,"{'shortage_assessment': 'The current shortage is emerging, with insufficient supply and disrupted market stability due to two manufacturer disruptions.', 'intervention_justification': 'A monitoring statement is appropriate as it acknowledges the situation and encourages voluntary reporting without causing panic. The alert urgency is elevated due to moderate patient safety risk and coordination problems.', 'market_impact_prediction': 'This announcement will likely lead to increased manufacturer transparency and reporting, helping to identify critical points for coordination. It should not trigger significant panic buying.', 'patient_safety_considerations': 'Patient safety risk is moderate, suggesting the need for monitoring and information gathering to prevent further clinical impact and ensure patient access.'}"
alert,The FDA is aware of an emerging drug shortage and is actively coordinating with manufacturers to address supply issues. We encourage stakeholders to report production capabilities and inventory levels.,elevated,2025-07-30T13:32:52.866972,3,"{'shortage_assessment': 'The shortage is in its emerging phase with insufficient supply and volatile market stability, requiring proactive measures.', 'intervention_justification': 'Issuing a shortage alert will help coordinate efforts among manufacturers and stakeholders, reducing the risk of long-term impacts.', 'market_impact_prediction': 'The alert should prompt manufacturers to increase production capacity while buyers remain informed and avoid excessive stockpiling.', 'patient_safety_considerations': 'Monitoring closely reveals no immediate safety risks, but proactive coordination will safeguard against potential patient access issues.'}"
alert,The FDA is aware of an emerging drug shortage situation involving multiple manufacturers. We are actively coordinating with manufacturers to mitigate disruptions and encourage voluntary transparency in reporting any supply changes. Healthcare providers should consider alternative treatments where appropriate. Further updates will follow as more information becomes available.,elevated,2025-07-30T13:33:35.219226,4,"{'shortage_assessment': 'The current status involves two manufacturer disruptions leading to an insufficient supply, with a trajectory suggesting worsening conditions if unaddressed.', 'intervention_justification': 'Issuing an alert is appropriate given the moderate patient safety risk and potential for better coordination among stakeholders. It is a balanced response that provides transparency without causing undue panic.', 'market_impact_prediction': 'Manufacturers are expected to review their production capacity and report any further issues voluntarily. Buyers may increase cautious procurement but are not expected to hoard, given the moderate level of communication urgency.', 'patient_safety_considerations': 'The moderate risk to patient safety due to potential disruptions justifies timely communication to ensure that healthcare providers can make informed treatment decisions.'}"
alert,The FDA is aware of the emerging drug shortage and encourages manufacturers and stakeholders to coordinate for improved supply chain stability. Stakeholders are urged to report supply issues promptly to facilitate resolution.,elevated,2025-07-30T13:34:21.829738,5,"{'shortage_assessment': 'The current shortage status is emerging with inadequate supply, and the market is already exhibiting signs of instability. Coordination among stakeholders could positively impact resolution.', 'intervention_justification': 'An alert is warranted due to the elevated urgency and potential for moderate patient safety risks if unresolved. This level of response is appropriate to encourage coordination without inducing panic buying.', 'market_impact_prediction': 'Manufacturers may increase capacity in response to public awareness, while buyers should remain calm with guidance against stockpiling. Overall, coordination should improve supply chain efficiency.', 'patient_safety_considerations': 'There is a moderate risk to patient safety if the shortage progresses. Timely intervention could mitigate this by ensuring better drug availability.'}"
alert,The FDA is issuing a shortage alert for [Drug Name]. We are working closely with manufacturers and stakeholders to address supply disruptions. Patients and healthcare providers are advised to use existing stock judiciously. We request healthcare providers to report any supply challenges they encounter.,elevated,2025-07-30T13:35:04.043959,6,"{'shortage_assessment': 'The current shortage is emerging with insufficient supply and two manufacturers facing disruptions. The volatility and need for coordination suggest potential escalation without timely intervention.', 'intervention_justification': 'An alert will help coordinate industry response and prevent the situation from deteriorating further. The moderate patient safety risk necessitates timely information dissemination.', 'market_impact_prediction': 'Manufacturers may be encouraged to expedite production increases and buffer stocks might be utilized judiciously, while buyers may initially react with some precautionary purchasing behavior.', 'patient_safety_considerations': 'Moderate risk necessitates allowing providers to plan for supply constraints, thus ensuring patient needs are prioritized in allocations.'}"
alert,The FDA is aware of an emerging drug shortage and is actively coordinating with manufacturers and other stakeholders to address disruptions. We encourage voluntary reporting and the exploration of potential capacity expansion by manufacturers.,elevated,2025-07-30T13:35:49.506503,7,"{'shortage_assessment': 'The shortage is emerging with supply currently insufficient to meet demand, and market stability disrupted due to multiple manufacturer disruptions.', 'intervention_justification': 'Issuing an alert can help facilitate coordination efforts and encourage manufacturers to increase production capacity. This level of response provides necessary transparency without triggering panic.', 'market_impact_prediction': 'The alert is expected to mobilize manufacturers to expand capacity while informing buyers about the current state, reducing the risk of panic buying.', 'patient_safety_considerations': 'Moderate patient safety risk necessitates timely intervention to prevent further escalation and ensure continued access to essential medications.'}"
alert,The FDA acknowledges an emerging shortage impacting specific medications. We recommend enhanced coordination among manufacturers to increase supply and assure distribution. Healthcare providers should prioritize critical needs. Continuous updates will be provided as we closely monitor the situation.,elevated,2025-07-30T13:36:39.688639,8,"{'shortage_assessment': 'The current status shows an emerging shortage with insufficient supply and moderate market disruption. The trajectory suggests escalating shortages without intervention.', 'intervention_justification': 'An alert-level response is suitable to enhance manufacturer coordination and voluntary reporting without triggering panic buying. The situation does not yet demand a critical shortage response, but coordinated action is necessary.', 'market_impact_prediction': 'The announcement is expected to prompt manufacturers to assess production capacities and explore voluntary expansion. Buyers may increase orders moderately but are less likely to hoard due to the lack of critical shortage context.', 'patient_safety_considerations': 'Patient safety implications are currently low to moderate but could worsen if manufacturers do not coordinate. Ensuring supply adequacy through prompt coordination is essential to prevent future patient access issues.'}"
