type,message,urgency,timestamp,period,decision_context
monitoring,The FDA is aware of emerging supply issues for this drug. We encourage manufacturers to report supply capabilities and buyers to manage inventory responsibly. Coordination efforts are underway to address potential disruptions.,elevated,2025-07-28T00:03:42.177962,1,"{'shortage_assessment': 'The shortage is emerging with insufficient supply and disrupted market stability. Coordination could be beneficial at this stage.', 'intervention_justification': 'A monitoring statement is appropriate to acknowledge the situation and encourage voluntary reporting without causing panic buying.', 'market_impact_prediction': 'Manufacturers may begin to assess capacity expansion, and buyers are encouraged to avoid stockpiling, maintaining market stability.', 'patient_safety_considerations': 'Current patient safety risk is low, but proactive communication can prevent escalation.'}"
alert,The FDA is aware of an emerging shortage in the market. We encourage manufacturers to increase production capacity where possible and urge healthcare providers to report any supply issues. Coordination among stakeholders is essential to mitigate impacts on patient care.,elevated,2025-07-28T00:04:05.110563,2,"{'shortage_assessment': 'The shortage is emerging with insufficient supply and disrupted market stability. Coordination is needed to address manufacturer disruptions.', 'intervention_justification': 'An alert is appropriate as it facilitates coordination without causing panic. Historical precedents show early alerts can help resolve shortages.', 'market_impact_prediction': 'Manufacturers may be encouraged to expand capacity, and buyers will be informed, reducing the likelihood of panic buying.', 'patient_safety_considerations': 'Moderate risk exists due to potential supply issues. Public information can help manage patient care continuity.'}"
alert,The FDA is issuing a shortage alert for the affected drug. We encourage manufacturers to increase production and stakeholders to coordinate efforts to mitigate the impact. Please report any supply issues to the FDA promptly.,elevated,2025-07-28T00:04:27.349599,3,"{'shortage_assessment': 'The shortage is emerging with insufficient supply and disrupted market stability. Coordination among stakeholders is needed to address potential supply chain issues.', 'intervention_justification': 'An alert is appropriate to facilitate industry coordination and encourage manufacturers to expand capacity without causing panic buying.', 'market_impact_prediction': 'Manufacturers are likely to respond by assessing capacity expansion, and buyers may increase orders moderately. Coordination efforts should stabilize the market.', 'patient_safety_considerations': 'While the patient safety risk is low to moderate, timely intervention can prevent escalation and ensure continued access to the drug.'}"
alert,The FDA is aware of an emerging shortage in the market. We are actively monitoring the situation and encourage manufacturers to increase production where possible. We urge stakeholders to report any supply disruptions and coordinate efforts to ensure patient needs are met.,elevated,2025-07-28T00:04:50.078075,4,"{'shortage_assessment': 'The shortage is emerging with insufficient supply and disrupted market stability. Coordination has been identified as helpful.', 'intervention_justification': 'An alert is appropriate given the elevated urgency and partial evidence of coordination problems. Early communication aligns with precedent guidance.', 'market_impact_prediction': 'The announcement is expected to encourage manufacturers to expand capacity and facilitate industry coordination without causing significant panic buying.', 'patient_safety_considerations': 'While the patient safety risk is low to moderate, early intervention can prevent escalation and ensure continued access to necessary medications.'}"
monitoring,The FDA is aware of emerging supply disruptions in the market. We are actively monitoring the situation and encourage manufacturers and healthcare providers to report any significant changes in supply levels. Coordination efforts are underway to ensure continued patient access.,routine,2025-07-28T00:05:14.020158,5,"{'shortage_assessment': 'The shortage is emerging but supply is currently adequate. Market stability is disrupted, and coordination could be beneficial.', 'intervention_justification': 'A monitoring statement is appropriate as the intervention threshold has not been met, and there is no immediate patient safety risk.', 'market_impact_prediction': 'The announcement is expected to encourage voluntary reporting and coordination without causing panic buying or significant market disruptions.', 'patient_safety_considerations': 'Patient safety risk is low at this stage, and access concerns are not yet critical.'}"
monitoring,The FDA is aware of emerging supply disruptions in the market. We encourage manufacturers and healthcare providers to report any significant changes in supply levels. Coordination among stakeholders is advised to ensure continued patient access.,routine,2025-07-28T00:05:39.692916,6,"{'shortage_assessment': 'The shortage is emerging with adequate current supply, but market stability is disrupted. Coordination could be helpful to prevent further issues.', 'intervention_justification': 'A monitoring statement is appropriate to acknowledge the situation without causing unnecessary alarm or stockpiling. It encourages voluntary reporting and coordination.', 'market_impact_prediction': 'Manufacturers may be encouraged to assess their capacity and consider adjustments, while buyers are informed without triggering panic buying.', 'patient_safety_considerations': 'Patient safety risk is low at this stage, and current supply is adequate. Monitoring will help ensure early detection of any changes that could impact patient access.'}"
monitoring,The FDA is closely monitoring the emerging drug shortage situation. We encourage manufacturers and healthcare providers to report any supply issues and are ready to facilitate coordination if needed.,routine,2025-07-28T00:06:02.406459,7,"{'shortage_assessment': 'The shortage is emerging but currently, supply is adequate. Market stability is disrupted, but there is no immediate patient safety risk.', 'intervention_justification': 'A monitoring statement is appropriate to acknowledge the situation and encourage voluntary reporting without causing panic or unnecessary stockpiling.', 'market_impact_prediction': ""Manufacturers may be encouraged to assess their capacity, while buyers are reassured, minimizing panic buying. Coordination may improve as stakeholders are aware of FDA's involvement."", 'patient_safety_considerations': 'With a low patient safety risk and adequate supply, immediate intervention is not necessary, but ongoing monitoring is crucial to prevent escalation.'}"
